{
  "schema_version": 1,
  "paper_id": "80",
  "figure_id": "1",
  "source_image": "../mineru_output/paper_80/images/962b642f171e961d5b8fc108b3b6fcdd62b2ce14cce8c212fa9a0b5657495436.jpg",
  "caption": "Pitting potentials for freshly deposited samples, Ep, and aged samples, Epa, along with repassivation potentials, ER, for pure Al and AlNb alloys.",
  "x_axis": {"label": "Nb Concentration", "unit": "at.%", "scale": "linear"},
  "y_axis": {"label": "Potential", "unit": "mV", "reference": "SCE", "scale": "linear"},
  "composition_context": {"base_element": "Al", "solute_element": "Nb"},
  "calibration": {
    "plot_box": [117, 10, 645, 447],
    "x": [{"pixel": 152, "value": 0}, {"pixel": 562, "value": 40}],
    "y": [{"pixel": 383, "value": -500}, {"pixel": 105, "value": 1000}]
  },
  "series": [
    {
      "series_id": "ep_aged",
      "label": "Ep^a",
      "metric": "pitting_potential",
      "sample_condition": "aged",
      "marker_type": "open circle",
      "points": [
        {"x": 0, "y": -520, "uncertainty_x": 0.5, "uncertainty_y": 35, "confidence": 0.78},
        {"x": 0, "y": -470, "uncertainty_x": 0.5, "uncertainty_y": 35, "confidence": 0.72},
        {"x": 4, "y": 100, "uncertainty_x": 0.5, "uncertainty_y": 35, "confidence": 0.88},
        {"x": 15.5, "y": 700, "uncertainty_x": 0.7, "uncertainty_y": 40, "confidence": 0.87},
        {"x": 26.5, "y": 890, "uncertainty_x": 0.7, "uncertainty_y": 45, "confidence": 0.82},
        {"x": 26.5, "y": 1080, "uncertainty_x": 0.7, "uncertainty_y": 45, "confidence": 0.83},
        {"x": 26.5, "y": 1190, "uncertainty_x": 0.7, "uncertainty_y": 45, "confidence": 0.82},
        {"x": 26.5, "y": 1430, "uncertainty_x": 0.7, "uncertainty_y": 50, "confidence": 0.84}
      ]
    },
    {
      "series_id": "ep_fresh",
      "label": "Ep",
      "metric": "pitting_potential",
      "sample_condition": "freshly deposited",
      "marker_type": "open triangle",
      "points": [
        {"x": 0, "y": -700, "uncertainty_x": 0.5, "uncertainty_y": 35, "confidence": 0.91},
        {"x": 4, "y": -170, "uncertainty_x": 0.5, "uncertainty_y": 35, "confidence": 0.9},
        {"x": 15.5, "y": 320, "uncertainty_x": 0.7, "uncertainty_y": 35, "confidence": 0.9},
        {"x": 21, "y": 430, "uncertainty_x": 0.7, "uncertainty_y": 35, "confidence": 0.88},
        {"x": 27, "y": 620, "uncertainty_x": 0.7, "uncertainty_y": 35, "confidence": 0.91},
        {"x": 35, "y": 680, "uncertainty_x": 0.8, "uncertainty_y": 35, "confidence": 0.9}
      ]
    },
    {
      "series_id": "er",
      "label": "ER",
      "metric": "repassivation_potential",
      "sample_condition": "not specified",
      "marker_type": "open square",
      "points": [
        {"x": 0, "y": -750, "uncertainty_x": 0.5, "uncertainty_y": 35, "confidence": 0.88},
        {"x": 4, "y": -240, "uncertainty_x": 0.5, "uncertainty_y": 35, "confidence": 0.87},
        {"x": 15.5, "y": 210, "uncertainty_x": 0.7, "uncertainty_y": 35, "confidence": 0.88},
        {"x": 26.5, "y": 480, "uncertainty_x": 0.7, "uncertainty_y": 35, "confidence": 0.89}
      ]
    }
  ],
  "notes": "Initial agent-assisted dry-run values; validate against the overlay and future manual gold set."
}

